{
  "$schema": "./docs/schemas/tech-debt-ledger.schema.json",
  "version": "2.0.0",
  "project": "LIVA Banking System (Rust Native Core)",
  "generated_at": "2026-09-14T11:25:00Z",
  "milestone": "M5",
  "commit_baseline": "67eb98b",
  "summary": {
    "total_cataloged_items": 22,
    "core_items_resolved": 14,
    "core_items_total": 14,
    "intentional_residual_debts": 2,
    "monitored_secondary_debts": 6,
    "health_score": 100,
    "audit_status": "VERIFIED_PASS"
  },
  "core_resolved_debt": [
    {
      "id": "D-01",
      "title": "SQLite WAL Multi-Threading & DbActor Async Serialization Queue",
      "subsystems": [
        "liva-native-core/src/db_actor.rs",
        "liva-native-core/src/db.rs",
        "liva-native-core/src/boot.rs"
      ],
      "milestone": "M1",
      "status": "RESOLVED",
      "resolved_at": "2026-09-14",
      "root_cause": "Concurrent Tokio tasks simultaneously borrowed SQLite write connections via r2d2, causing SQLITE_BUSY deadlocks and RISK-01 silent drop turn defect.",
      "resolution": "Dedicated OS thread 'liva-db-writer-actor' owning single SQLite writer connection via 1024-bounded mpsc queue with backpressure and periodic 15m PASSIVE checkpointing.",
      "source_evidence": [
        "liva-native-core/src/db_actor.rs:78-85",
        "liva-native-core/src/db.rs:245",
        "liva-native-core/src/db.rs:272-279",
        "liva-native-core/src/boot.rs:567-596"
      ],
      "test_evidence": [
        {
          "file": "liva-native-core/tests/m1_resilience_adversarial_challenge.rs",
          "function": "test_db_actor_concurrent_async_and_sync_writers_no_deadlock"
        },
        {
          "file": "liva-native-core/tests/m1_resilience_adversarial_challenge.rs",
          "function": "test_db_actor_backpressure_burst_exceeding_queue_capacity"
        },
        {
          "file": "liva-native-core/tests/m1_resilience_adversarial_challenge.rs",
          "function": "test_db_actor_500_turn_burst_wal_checkpoints_and_concurrent_readers_zero_busy"
        }
      ]
    },
    {
      "id": "D-02",
      "title": "SQLite Vector Upsert Transaction Atomicity & Rollback Protection",
      "subsystems": [
        "liva-native-core/src/db.rs"
      ],
      "milestone": "M1",
      "status": "RESOLVED",
      "resolved_at": "2026-09-14",
      "root_cause": "Multi-table vector upsert across vectors_meta, vec_idx, and vectors_fts was non-atomic, leaving orphaned rows when downstream quantization or FTS failed.",
      "resolution": "Implemented check_vector_dim validation gate and conn.is_autocommit() transaction wrapper enforcing full rollback on sub-step error.",
      "source_evidence": [
        "liva-native-core/src/db.rs:1694-1808",
        "liva-native-core/src/db.rs:1707",
        "liva-native-core/src/db.rs:1733-1737"
      ],
      "test_evidence": [
        {
          "file": "liva-native-core/tests/m1_resilience_adversarial_challenge.rs",
          "function": "test_upsert_vector_atomicity_clean_rollback_on_fts_failure"
        },
        {
          "file": "liva-native-core/tests/m1_resilience_adversarial_challenge.rs",
          "function": "test_upsert_vector_atomicity_clean_rollback_on_vec_idx_failure"
        },
        {
          "file": "liva-native-core/tests/m1_resilience_adversarial_challenge.rs",
          "function": "test_upsert_vector_respects_outer_transaction_rollback"
        },
        {
          "file": "liva-native-core/src/main_tests.rs",
          "function": "cmd_upsert_vector_guard_chieu_2_3"
        }
      ]
    },
    {
      "id": "D-03",
      "title": "WebRTC VAD Memory Bounds (32,000 Samples Clamp)",
      "subsystems": [
        "liva-native-core/src/webrtc/vad.rs"
      ],
      "milestone": "M1",
      "status": "RESOLVED",
      "resolved_at": "2026-09-14",
      "root_cause": "PCM residual_buffer could expand unbounded during network lag or audio chunk burst, causing memory leaks and multi-second latency.",
      "resolution": "Clamped residual buffer to MAX_RESIDUAL_CAPACITY = 32_000 samples (2.0s audio @ 16kHz) with FIFO drain and explicit reset() clean-up.",
      "source_evidence": [
        "liva-native-core/src/webrtc/vad.rs:241",
        "liva-native-core/src/webrtc/vad.rs:294-302",
        "liva-native-core/src/webrtc/vad.rs:327-340"
      ],
      "test_evidence": [
        {
          "file": "liva-native-core/tests/m1_audio_panic_adversarial_challenge.rs",
          "function": "challenge_vad_max_residual_capacity_strictly_clamped_on_massive_chunk"
        },
        {
          "file": "liva-native-core/tests/m1_audio_panic_adversarial_challenge.rs",
          "function": "challenge_vad_unaligned_streaming_chunks_no_unbounded_accumulation"
        },
        {
          "file": "liva-native-core/tests/m1_audio_panic_adversarial_challenge.rs",
          "function": "challenge_vad_reset_clears_residual_and_recurrent_state"
        }
      ]
    },
    {
      "id": "D-04",
      "title": "Panic Elimination Across STT, TTS, LLM, WebRTC, WebSocket",
      "subsystems": [
        "liva-native-core/src/governor.rs",
        "liva-native-core/src/stt/mod.rs",
        "liva-native-core/src/tts/mod.rs",
        "liva-native-core/src/websocket.rs",
        "liva-native-core/src/tts/audio.rs"
      ],
      "milestone": "M1",
      "status": "RESOLVED",
      "resolved_at": "2026-09-14",
      "root_cause": "Raw .unwrap() and .expect() calls triggered cascading process panics on lock poisoning, missing Kokoro voices, or transient socket resets.",
      "resolution": "Replaced mutex unwrap with .unwrap_or_else(|e| e.into_inner()), converted fallible APIs to Result, added Kokoro empty fallback and 50ms websocket retry backoff.",
      "source_evidence": [
        "liva-native-core/src/governor.rs:120-155",
        "liva-native-core/src/tts/audio.rs:25",
        "liva-native-core/src/tts/mod.rs:579-589",
        "liva-native-core/src/websocket.rs:379-385"
      ],
      "test_evidence": [
        {
          "file": "liva-native-core/tests/m1_audio_panic_adversarial_challenge.rs",
          "function": "challenge_stt_missing_or_corrupted_model_returns_graceful_err_no_panic"
        },
        {
          "file": "liva-native-core/tests/m1_audio_panic_adversarial_challenge.rs",
          "function": "challenge_vieneu_non_contiguous_tensor_returns_graceful_err"
        },
        {
          "file": "liva-native-core/tests/m1_audio_panic_adversarial_challenge.rs",
          "function": "challenge_governor_handles_mode_transitions_without_panic"
        },
        {
          "file": "liva-native-core/tests/m3_ipc_sync_adversarial_challenge.rs",
          "function": "test_websocket_widget_audio_events_malformed_fuzz"
        }
      ]
    },
    {
      "id": "D-05",
      "title": "Multi-Model Idle Memory Reclamation (VieNeu ~500MB & Parakeet ~2.4GB)",
      "subsystems": [
        "liva-native-core/src/stt/mod.rs",
        "liva-native-core/src/tts/vieneu/mod.rs",
        "liva-native-core/src/boot.rs"
      ],
      "milestone": "M2",
      "status": "RESOLVED",
      "resolved_at": "2026-09-14",
      "root_cause": "VieNeu and Parakeet heavy ONNX weights remained resident permanently in RAM, consuming 3.5GB to 4.0GB even during idle hours.",
      "resolution": "Implemented check_idle_unload and unload_sessions to drop ONNX sessions after 300s of inactivity via non-blocking try_lock() sweep in boot.rs.",
      "source_evidence": [
        "liva-native-core/src/stt/mod.rs:259-283",
        "liva-native-core/src/tts/vieneu/mod.rs:367-385",
        "liva-native-core/src/boot.rs:500-534",
        "liva-native-core/src/boot.rs:616-661"
      ],
      "test_evidence": [
        {
          "file": "liva-native-core/src/stt/mod.rs",
          "function": "stt_idle_unload_reclaims_parakeet_when_timeout_elapsed"
        },
        {
          "file": "liva-native-core/src/tts/mod.rs",
          "function": "test_tts_manager_check_idle_unload_does_not_panic"
        },
        {
          "file": "liva-native-core/src/boot.rs",
          "function": "check_voice_idle_unload_non_blocking_when_locked"
        },
        {
          "file": "liva-native-core/tests/m2_memory_idle_adversarial_challenge.rs",
          "function": "test_check_voice_idle_unload_non_blocking_when_stt_held"
        }
      ]
    },
    {
      "id": "D-06",
      "title": "Lazy Model Reloading Without Audio Latency Spikes",
      "subsystems": [
        "liva-native-core/src/stt/mod.rs",
        "liva-native-core/src/tts/vieneu/mod.rs",
        "liva-native-core/src/tts/mod.rs"
      ],
      "milestone": "M2",
      "status": "RESOLVED",
      "resolved_at": "2026-09-14",
      "root_cause": "Synchronous on-demand reload of heavy ONNX models while holding Mutex froze the audio pipeline and UI thread for 1.5s to 3.0s.",
      "resolution": "Isolated synthesis_plan clone outside of locks, offloaded heavy inference and reload to tokio::task::spawn_blocking, with seamless Piper fallback tier.",
      "source_evidence": [
        "liva-native-core/src/stt/mod.rs:198-224",
        "liva-native-core/src/tts/vieneu/mod.rs:336-365",
        "liva-native-core/src/tts/mod.rs:545-566",
        "liva-native-core/src/tts/mod.rs:708-720"
      ],
      "test_evidence": [
        {
          "file": "liva-native-core/src/bin/verify_duplex.rs",
          "function": "Full Duplex Barge-in Latency Verification"
        },
        {
          "file": "scripts/e2e-gateway-ci.mjs",
          "function": "Live Socket Gateway Connection Suite (8/8 pass)"
        }
      ]
    },
    {
      "id": "D-07",
      "title": "Nghị định 13/2023/NĐ-CP Compliance Redaction (CCCD, SĐT, STK)",
      "subsystems": [
        "liva-native-core/src/cognitive/redaction.rs"
      ],
      "milestone": "M2",
      "status": "RESOLVED",
      "resolved_at": "2026-09-14",